{
  "$schema": "http://json-schema.org/draft-07/schema#",
  "type": "array",
  "items": {
    "type": "object",
    "required": ["name", "description", "type"],
    "properties": {
      "name": { "type": "string" },
      "description": { "type": "string" },
      "type": { "type": "string", "enum": ["components", "docs"] },
      "files": { "type": "array" },
      "dependencies": { "type": "array" },
      "devDependencies": { "type": "array" },
      "registryDependencies": { "type": "array" }
    }
  }
}
