[
  {
    "name": "data-grid-core",
    "description": "Core DataGrid component with hooks, types, and utilities. Includes use-data-grid orchestration, filtering, sorting, selection state, virtualization integration, and tree-mode support.",
    "type": "components",
    "files": [
      {
        "path": "src/components/data-grid/data-grid.tsx",
        "target": "components/data-grid/data-grid.tsx"
      },
      {
        "path": "src/components/data-grid/data-grid-context.tsx",
        "target": "components/data-grid/data-grid-context.tsx"
      },
      {
        "path": "src/components/data-grid/data-grid-header.tsx",
        "target": "components/data-grid/data-grid-header.tsx"
      },
      {
        "path": "src/components/data-grid/data-grid-row.tsx",
        "target": "components/data-grid/data-grid-row.tsx"
      },
      {
        "path": "src/components/data-grid/data-grid-cell.tsx",
        "target": "components/data-grid/data-grid-cell.tsx"
      },
      {
        "path": "src/components/data-grid/data-grid-toolbar.tsx",
        "target": "components/data-grid/data-grid-toolbar.tsx"
      },
      {
        "path": "src/components/data-grid/data-grid-pagination.tsx",
        "target": "components/data-grid/data-grid-pagination.tsx"
      },
      {
        "path": "src/components/data-grid/data-grid-empty.tsx",
        "target": "components/data-grid/data-grid-empty.tsx"
      },
      {
        "path": "src/components/data-grid/data-grid-skeleton.tsx",
        "target": "components/data-grid/data-grid-skeleton.tsx"
      },
      {
        "path": "src/components/data-grid/data-grid-row-skeleton.tsx",
        "target": "components/data-grid/data-grid-row-skeleton.tsx"
      },
      {
        "path": "src/components/data-grid/hooks/use-data-grid.ts",
        "target": "components/data-grid/hooks/use-data-grid.ts"
      },
      {
        "path": "src/components/data-grid/hooks/use-column-resize.ts",
        "target": "components/data-grid/hooks/use-column-resize.ts"
      },
      {
        "path": "src/components/data-grid/hooks/use-infinite-data.ts",
        "target": "components/data-grid/hooks/use-infinite-data.ts"
      },
      {
        "path": "src/components/data-grid/types/grid-types.ts",
        "target": "components/data-grid/types/grid-types.ts"
      },
      {
        "path": "src/components/data-grid/types/column-types.ts",
        "target": "components/data-grid/types/column-types.ts"
      },
      {
        "path": "src/components/data-grid/types/filter-types.ts",
        "target": "components/data-grid/types/filter-types.ts"
      },
      {
        "path": "src/components/data-grid/types/sort-types.ts",
        "target": "components/data-grid/types/sort-types.ts"
      },
      {
        "path": "src/components/data-grid/types/editor-types.ts",
        "target": "components/data-grid/types/editor-types.ts"
      },
      {
        "path": "src/components/data-grid/types/slot-types.ts",
        "target": "components/data-grid/types/slot-types.ts"
      },
      {
        "path": "src/components/data-grid/types/index.ts",
        "target": "components/data-grid/types/index.ts"
      },
      {
        "path": "src/components/data-grid/utils/grid-utils.ts",
        "target": "components/data-grid/utils/grid-utils.ts"
      },
      {
        "path": "src/components/data-grid/utils/formatters.ts",
        "target": "components/data-grid/utils/formatters.ts"
      },
      {
        "path": "src/components/data-grid/utils/csv-export.ts",
        "target": "components/data-grid/utils/csv-export.ts"
      },
      {
        "path": "src/components/data-grid/index.ts",
        "target": "components/data-grid/index.ts"
      }
    ],
    "dependencies": [
      "@tanstack/react-table@^8.21.3",
      "@tanstack/react-query@^5.90.21",
      "@tanstack/react-virtual@^3.13.21",
      "@dnd-kit/core@^6.3.1",
      "@dnd-kit/sortable@^10.0.0",
      "@dnd-kit/utilities@^3.2.2",
      "date-fns@^4.1.0",
      "clsx@^2.1.1",
      "match-sorter@^8.2.0",
      "@tanstack/match-sorter-utils@^8.19.4"
    ],
    "devDependencies": [],
    "registryDependencies": [
      "table",
      "button",
      "popover",
      "dropdown-menu",
      "select",
      "dialog",
      "calendar",
      "input"
    ]
  },
  {
    "name": "data-grid-columns",
    "description": "Typed column factory helpers for string, number, boolean, select, multi-value, date, and code columns.",
    "type": "components",
    "files": [
      {
        "path": "src/components/data-grid/columns/string-column.tsx",
        "target": "components/data-grid/columns/string-column.tsx"
      },
      {
        "path": "src/components/data-grid/columns/number-column.tsx",
        "target": "components/data-grid/columns/number-column.tsx"
      },
      {
        "path": "src/components/data-grid/columns/boolean-column.tsx",
        "target": "components/data-grid/columns/boolean-column.tsx"
      },
      {
        "path": "src/components/data-grid/columns/select-column.tsx",
        "target": "components/data-grid/columns/select-column.tsx"
      },
      {
        "path": "src/components/data-grid/columns/multi-value-column.tsx",
        "target": "components/data-grid/columns/multi-value-column.tsx"
      },
      {
        "path": "src/components/data-grid/columns/date-column.tsx",
        "target": "components/data-grid/columns/date-column.tsx"
      },
      {
        "path": "src/components/data-grid/columns/code-column.tsx",
        "target": "components/data-grid/columns/code-column.tsx"
      },
      {
        "path": "src/components/data-grid/columns/index.ts",
        "target": "components/data-grid/columns/index.ts"
      }
    ],
    "dependencies": [
      "lucide-react@^0.577.0"
    ],
    "devDependencies": [],
    "registryDependencies": [
      "input",
      "badge",
      "button",
      "select"
    ]
  },
  {
    "name": "data-grid-editors",
    "description": "Cell editor components for inline editing across column types (text, number, select, date, boolean, code, chips).",
    "type": "components",
    "files": [
      {
        "path": "src/components/data-grid/editors/text-editor.tsx",
        "target": "components/data-grid/editors/text-editor.tsx"
      },
      {
        "path": "src/components/data-grid/editors/number-editor.tsx",
        "target": "components/data-grid/editors/number-editor.tsx"
      },
      {
        "path": "src/components/data-grid/editors/boolean-editor.tsx",
        "target": "components/data-grid/editors/boolean-editor.tsx"
      },
      {
        "path": "src/components/data-grid/editors/select-editor.tsx",
        "target": "components/data-grid/editors/select-editor.tsx"
      },
      {
        "path": "src/components/data-grid/editors/date-editor.tsx",
        "target": "components/data-grid/editors/date-editor.tsx"
      },
      {
        "path": "src/components/data-grid/editors/code-editor.tsx",
        "target": "components/data-grid/editors/code-editor.tsx"
      },
      {
        "path": "src/components/data-grid/editors/chip-editor.tsx",
        "target": "components/data-grid/editors/chip-editor.tsx"
      },
      {
        "path": "src/components/data-grid/editors/get-editor.ts",
        "target": "components/data-grid/editors/get-editor.ts"
      },
      {
        "path": "src/components/data-grid/editors/index.ts",
        "target": "components/data-grid/editors/index.ts"
      }
    ],
    "dependencies": [
      "lucide-react@^0.577.0"
    ],
    "devDependencies": [],
    "registryDependencies": [
      "input",
      "select",
      "checkbox",
      "popover",
      "button",
      "calendar"
    ]
  },
  {
    "name": "data-grid-features",
    "description": "Modular feature implementations: filtering, sorting, selection, pinning, grouping, editing, tree expansion, virtualization, column ordering, and loading states.",
    "type": "components",
    "files": [
      {
        "path": "src/components/data-grid/features/filtering/column-filter-popover.tsx",
        "target": "components/data-grid/features/filtering/column-filter-popover.tsx"
      },
      {
        "path": "src/components/data-grid/features/filtering/facet-badge.tsx",
        "target": "components/data-grid/features/filtering/facet-badge.tsx"
      },
      {
        "path": "src/components/data-grid/features/filtering/filter-functions.ts",
        "target": "components/data-grid/features/filtering/filter-functions.ts"
      },
      {
        "path": "src/components/data-grid/features/filtering/filter-row.tsx",
        "target": "components/data-grid/features/filtering/filter-row.tsx"
      },
      {
        "path": "src/components/data-grid/features/filtering/fuzzy-filter.ts",
        "target": "components/data-grid/features/filtering/fuzzy-filter.ts"
      },
      {
        "path": "src/components/data-grid/features/filtering/use-filtering.ts",
        "target": "components/data-grid/features/filtering/use-filtering.ts"
      },
      {
        "path": "src/components/data-grid/features/sorting/sort-indicator.tsx",
        "target": "components/data-grid/features/sorting/sort-indicator.tsx"
      },
      {
        "path": "src/components/data-grid/features/sorting/use-sorting.ts",
        "target": "components/data-grid/features/sorting/use-sorting.ts"
      },
      {
        "path": "src/components/data-grid/features/selection/selection-cell.tsx",
        "target": "components/data-grid/features/selection/selection-cell.tsx"
      },
      {
        "path": "src/components/data-grid/features/selection/use-selection.ts",
        "target": "components/data-grid/features/selection/use-selection.ts"
      },
      {
        "path": "src/components/data-grid/features/pinning/pinned-shadow.tsx",
        "target": "components/data-grid/features/pinning/pinned-shadow.tsx"
      },
      {
        "path": "src/components/data-grid/features/pinning/use-column-pinning.ts",